"<h3>How to display brand slider:</h3><strong>Brand slider can be displayed on any CMS page and in any static block.</strong><br/>To display a brand slider in a selected place just use the slider block code (shortcode). The code is described in the <strong>User Guide</strong> (chapter 12).<br/>For example, enter the code in the content field of your static block, Magento will automatically replace the code with a brand slider during page rendering.<br/><br/>In this tab you can configure global settings of brand sliders. Use available parameters (see the user guide for details) in block code<br/>to override global settings for selected sliders.<br/><br/>","Вы можете добавить карусель брендов на любую самодельную страницу и в любой самодельный блок посредством специального макроса:<pre>{{block{\n}{\t}type='brands/brands'{\n}{\t}template='infortis/brands/brand_slider.phtml'{\n}{\t}breakpoints='[0, 1], [320, 2], [480, 2], [768, 3], [960, 4], [1280, 5]'{\n}{\t}block_name='Название блока'{\n}}}</pre><a href='http://magento-forum.ru/topic/4810/' style='color:rgb(234, 118, 1); margin-left:0;'>документация к модулю</a>"
"All Brands","Показывать ли все бренды?"
"Append Category URL Suffix","Добавлять ли к адресам страниц брендов то же окончание, что и для страниц товарных разделов?"
"Automatic Scrolling Speed","Длительность (в милисекундах) анимации шага автоматический прокрутки карусели брендов"
"Base Path of Brand Pages","Общее начало адресов страниц брендов"
"Brand Slider","Карусель брендов"
"Brands","Бренды"
"Brands Assigned To Products","Отображать ли только те бренды, для которых в текущем товарном разделе присутствуют товары?"
"Brands Assigned To Products In Stock","Отображать ли только те бренды, для которых в текущем товарном разделе присутствуют имеющиеся в наличии на складе магазина товары?"
"Brand Attribute Code","Системное имя товарного свойства"
"Brand Image File Extension","Расширение имён файлов с логотипами брендов"
"Brand List","Витринная страница товарного раздела"
"Brand Logo is a Link to...","Куда должна вести гиперссылка с логотипа бренда?"
"Brand on Product Page","Отображать ли информацию о бренде на витринной товарной карточке?"
"Click to see more products from %s","Нажмите для просмотра всех товаров бренда «%s»."
"Delays loading of images to speed up page loading. Images outside of viewport will not be loaded before user scrolls to them.",""
"Duration (in milliseconds) of scrolling animation. Applied to automatic scrolling (if <strong>Timeout</strong> was specified) and to scrolling with pagination.",""
"Duration (in milliseconds) of scrolling animation. Applied to scrolling with arrows (and touch swipe).",""
"Filter Brands","Отображать ли только релевантные текущему товарному разделу бренды?"
"Identifier of the attribute which contains the information about brands in your store. Search for that code in <em>Catalog > Attributes > Manage Attributes</em>.","Модуль будет извлекать информацию об брендах из указанного Вами товарного свойства."
"If <strong>Category URL Suffix</strong> exists (in System > Configuration > Catalog), it can be appended at the end of the URL of a brand page. For example: www.example.com/brands/apple<strong style=""color:red"">.html</strong> (assuming that <strong style=""color:red"">.html</strong> was set as <strong>Category URL Suffix</strong>).","Если Вы укажете значение «да», то система будет добавлять к адресам страниц брендов то же окончание, что и для страниц товарных разделов (оно задаётся в разделе настроек «Система» → «Настройки» → «Каталог» → «Каталог» → «Оптимизация в поисковых системах (SEO)» → «Окончание для адресов страниц товарных разделов»).<br/>Например, если таким окончанием является «<strong style=""color:red"">.html</strong>», то система может сформировать для страницы бренда адрес: http://www.example.ru/brands/apple<strong style=""color:red"">.html</strong>"
"If enabled, animation will loop.",""
"If enabled, when the slider is mouseovered then the automatic transition functionality will pause.",""
"If set to ""No"", brand image will be replaced with brand name (simple text).","Если Вы укажете значение «нет», то модуль вместо логотипа будет показывать текстовое название бренда."
"If set to ""Yes"", all existing brands will be displayed. If set to ""No"", you will be able to select brands in the field below.","Если Вы укажете значение «нет», то система предложит Вам выбрать бренды для показа."
"If set to ""Yes"", display only those brands, which are currently assigned to products.",""
"If set to ""Yes"", display only those brands, which are currently assigned to products which are in stock.","Если Вы укажете значение «да», то система  не будет показывать бренды, для которых в текущем товарном разделе либо нет товаров, либо товары в разделе есть, но они отсутствуют на складе магазина."
"If set to ""Yes"": if brand image doesn't exist, it will be replaced with brand name (simple text).<br/>If set to ""No"": if brand image doesn't exist, there will bo no info about brand.","Если Вы укажете значение «да», то при отсутствии логотипа система покажет название бренда текстом. Если Вы укажете значение «нет», то при отсутствии логотипа система не покажет название бренда."
"Image URL Key Separator","Разделитель слов в веб-адресах файлов логотипов"
"In this tab you can configure brand display on product page.",""
"In this tab you can configure global settings of brand display.<br/>This is the directory where you can upload your brand images: <em>media/wysiwyg/infortis/brands/</em><br/><br/>","Логотипы брендов поместите в папку <em>media/wysiwyg/infortis/brands/</em><br/><a href='http://magento-forum.ru/topic/4810/' style='color:rgb(234, 118, 1); margin-left:0;'>документация к модулю</a>"
"In this tab you can select list of brands to display.","В этом разделе настраивается отображение бренда на витринной странице товарного раздела (списка товаров)."
"Lazy Loading","Отложить загрузку с сервера файлов логотипов до попадания карусели брендов в поле зрения пользователя?"
"Loop","Сделать прокрутку циклической?"
"Navigation","Cтрелки для прокрутки карусели"
"Path specified in this field will be appended with the brand name to create a link to the brand page.<br/>Leave empty if no base path is needed. Path is relative to the store base URL. Do not add leading or trailing slashes. For more details please refer to the user guide.","Система будет формировать адреса страниц брендов следующим образом: http://example.ru/<Общее начало адресов страниц брендов>/<название бренда>.<br/>Пожалуйста, не указывайте в начале и в конце значения косую черту («/»): система сама добавит её при необходимости.<br/>Вы можете оставить значение пустым."
"Pause on Hover","Приостанавливать ли прокрутку карусели брендов при наведении указателя мыши?"
"Select Brands","Какие бренды отображать на витринной странице товарного раздела?"
"Select brands which you want to display","Выберите бренды для показа"
"Selected Brands","Бренды для показа"
"SEO Settings","Поисковая оптимизация"
"Show Brand Image","Показывать логотипы?"
"Show Text If No Brand Image","Показывать ли название бренда текстом при отсутствии логотипа?"
"Specify character which will be used as a word separator in the names of brand image files.<br/><strong style=""color:red;"">Important:</strong><br/>The <strong>Image URL Key Separator</strong> field was added for backward compatibility. In next versions this field will be removed and the character specified in the <strong>URL Key Separator</strong> field will also be used in the names of brand image files.<br/>To prepare your store for this, we recommend to use hyphen (-) as the separator for images. In previous versions underscore (_) was the default separator for images. So what you need to do is to enter hyphen in the <strong>Image URL Key Separator</strong> field and edit names of all your brand images: replace underscores with hyphens.<br/><strong>Example:</strong><br/>change file name <em>louis_vuitton.png</em> to <em>louis-vuitton.png</em>","Система будет использовать этот разделитель вместо пробелов и других недопустимых или нежелательных в веб-адресе символов для веб-адресов файлов логотипов.<br/>Например, для бренда <em>Marks & Spencer</em> при использовании разделителя «-» окончанием веб-адреса файла логотипа бреда может быть «<em>marks-spencer.png</em>»."
"Specify character which will be used as a word separator to generate links to custom brand pages. Brand name has to be simplified to be used in URL. Module will strip all whitespace characters and other non-letter and non-digit characters in brand name and replace them with separator. More information can be found in the user guide.<br/><strong>Example:</strong><br/>if brand name is <em>Marks & Spencer</em> and separator is hyphen (-), the brand name in URL will be the following: <em>marks-spencer</em><br/><strong style=""color:red;"">Important:</strong><br/>Hyphen (-) is the recommended separator. Other separators, such as underscores (_) or plus-signs (+) should be avoided. Source: <a href=""http://youtu.be/AQcSFsQyct8"">link</a>.","Система будет использовать этот разделитель вместо пробелов и других недопустимых или нежелательных в веб-адресе символов.<br/>Например, для бренда <em>Marks & Spencer</em> при использовании разделителя «-» уникальная часть веб-адреса будет «<em>marks-spencer</em>»."
"Speed","Длительность (в милисекундах) анимации шага ручной прокрутки карусели брендов"
"Timeout","Интервал (в милисекундах) между шагами автоматической прокрутки карусели брендов"
"To enable automatic scrolling, specify time (in milliseconds) between slide transitions. Leave empty to disable automatic scrolling. Note that 1000 miliseconds = 1 second.","При пустом значении карусель брендов не будет прокручиваться автоматически."
"URL Key Separator","Разделитель слов в веб-адресах страниц"
"With this option, you can decide whether brand logo is a link, e.g., to search results page.<br/>Set to ""Custom Page"" if you want the logo to be a link to custom pages (e.g., category view pages, CMS pages, pages created by 3rd-party extensions etc.) - more options will be displayed below.",""
"Without the leading dot.","без точки"